Indian Freight Logistics Fleet Control Sheet (Master Batch - 400 Dispatches),,,,,,
"Automated Operational Logging Framework mapping route dynamics, critical timeline windows, legal compliance checks, and raw dispatcher text.",,,,,,
,,,,,,
Task ID,Cargo Type,Route Restrictions,Time Constraints,Special Handling,Compliance / Documentation,Instruction (Hinglish)
IND-FR-001,Medical Infrastructure (CT Scanner Component Parts),"No low-clearance bridges, follow approved ODC route map",By evening (Before 06:00 PM),"Fragile, Glassware protocol, side foam padding required","Octroi Exempt Form (Govt hospital delivery), Delivery Challan signed","Emergency stock replenishment hai driver saab! Maal hai Medical Infrastructure (CT Scanner Component Parts). Location ke liye No low-clearance bridges, follow approved ODC route map ka use karein aur By evening (Before 06:00 PM) tak har haal me pahuchein. Fragile, Glassware protocol, side foam padding required ka khyal rakhna, Octroi Exempt Form (Govt hospital delivery), Delivery Challan signed sath hona chahiye."
IND-FR-002,Frozen Food (Frozen Meat Patties),"Avoid city flyovers, follow heavy transport corridor",By evening 04:30 PM,"Overhanging load, red flag and night reflector marking required",APMC state mandi transit token sheet approval logs verified,"Suno driver saab, Frozen Food (Frozen Meat Patties) ka load hamesha critical hota hai. Avoid city flyovers, follow heavy transport corridor corridor hi lena and secure velocity maintain karke By evening 04:30 PM tak report karo. Product is Overhanging load, red flag and night reflector marking required, aur border par APMC state mandi transit token sheet approval logs verified dikhana hoga."
IND-FR-003,Pharmaceuticals (Oncology Infusion Bags),Avoid Ring Road entirely due to daytime heavy vehicle ban,By evening 05:00 PM at Port,"Standard palletized distribution, avoid stacking near wet cargo",Transit Insurance Policy copy & Custom Clearance Docs in cabin,"Bhai, Pharmaceuticals (Oncology Infusion Bags) ka critical consignment hai. Route me Avoid Ring Road entirely due to daytime heavy vehicle ban follow karna aur By evening 05:00 PM at Port tak deliver kar dena. Standard palletized distribution, avoid stacking near wet cargo maintain rakhna, checkpost pe Transit Insurance Policy copy & Custom Clearance Docs in cabin check hoga."
IND-FR-004,Paints & Solvents (Commercial Paints),"Rural connectivity routes, verify bridge weight capacity before crossing",By evening 04:30 PM,"Shock-sensitive, air-suspension trailer routing",Transit Insurance Policy copy & Custom Clearance Docs in cabin,"High-value target load hai. Material details: Paints & Solvents (Commercial Paints). Route map setting: Rural connectivity routes, verify bridge weight capacity before crossing. Strict unloading timing: By evening 04:30 PM. Setup Shock-sensitive, air-suspension trailer routing checks, and checkpost processing ke liye Transit Insurance Policy copy & Custom Clearance Docs in cabin verified hona chahiye."
IND-FR-005,Industrial Gas (Compressed Nitrogen),"Avoid central flyovers, follow hazardous logistics ring",Strictly before 09:00 AM,"Chemical handling, protective masks for loaders mandatory",Excise Challan & Triplicate Invoice Copy checked post loading,"Important transport update! Consignment category: Industrial Gas (Compressed Nitrogen). Avoid central flyovers, follow hazardous logistics ring track follow karna delay se bachne ke liye. Delivery window is Strictly before 09:00 AM. Take care of Chemical handling, protective masks for loaders mandatory. Keep Excise Challan & Triplicate Invoice Copy checked post loading handy on dashboard."
IND-FR-006,Automotive Parts (Wiring Harnesses),"Smooth surfaces only, strictly avoid under-construction bypass roads",By late evening,"Deep Freeze (-20°C), continuous temperature data logging","Special ODC Permission from NHAI, Form 9 active in system","Attention driver saab: Automotive Parts (Wiring Harnesses) delivery ke liye nikal chuka hai. Strictly Smooth surfaces only, strictly avoid under-construction bypass roads se jana hai. Unloading target By late evening hai. Deep Freeze (-20°C), continuous temperature data logging instructions follow karo aur Special ODC Permission from NHAI, Form 9 active in system ready rakho."
IND-FR-007,Construction Material (Granite Slabs),"Avoid city flyovers, follow heavy transport corridor",Before afternoon 12:30 PM,"HAZMAT Class 9, Temperature monitored, dry zone packaging",OTP verification authorization validation activated on terminal map,"Dekho bhai, Construction Material (Granite Slabs) loaded hai gaadi me. Ring road mat lena, Avoid city flyovers, follow heavy transport corridor safe rahega. Subah Before afternoon 12:30 PM se pehle hub pahuchega toh achha hai. Maal HAZMAT Class 9, Temperature monitored, dry zone packaging hai, and custom pe OTP verification authorization validation activated on terminal map dikhana padega."
IND-FR-008,Glass Bottles (Beverage Industry),"Direct express route, no unauthorized stops",By evening 06:30 PM,"Highly Fragile medical diagnostic components, strict vibration sensor logs",Loading challan and toll receipts for reimbursement verification,"Suno driver saab, Glass Bottles (Beverage Industry) ka load hamesha critical hota hai. Direct express route, no unauthorized stops corridor hi lena and secure velocity maintain karke By evening 06:30 PM tak report karo. Product is Highly Fragile medical diagnostic components, strict vibration sensor logs, aur border par Loading challan and toll receipts for reimbursement verification dikhana hoga."
IND-FR-009,Frozen Food (Ice Cream Stock),"Shortest market connection lane, bypass checkpoint lines",By afternoon 03:00 PM,"Fragile glassware protocol, strict vertical alignment tracking",Bulk Delivery Manifest & Store Inward Voucher verified,"Emergency stock replenishment hai driver saab! Maal hai Frozen Food (Ice Cream Stock). Location ke liye Shortest market connection lane, bypass checkpoint lines ka use karein aur By afternoon 03:00 PM tak har haal me pahuchein. Fragile glassware protocol, strict vertical alignment tracking ka khyal rakhna, Bulk Delivery Manifest & Store Inward Voucher verified sath hona chahiye."
IND-FR-010,FMCG Goods (Soap & Detergents Bulk),Avoid waterlogging-prone routes and low-security zones,Within 2 hours max (Urgent replenishment),"Enclosed car carrier, hydraulic lift usage, zero scratches protocol",Agricultural Produce Marketing Committee (APMC) tax slip verified,"Attention driver saab: FMCG Goods (Soap & Detergents Bulk) delivery ke liye nikal chuka hai. Strictly Avoid waterlogging-prone routes and low-security zones se jana hai. Unloading target Within 2 hours max (Urgent replenishment) hai. Enclosed car carrier, hydraulic lift usage, zero scratches protocol instructions follow karo aur Agricultural Produce Marketing Committee (APMC) tax slip verified ready rakho."
IND-FR-011,Agricultural Fertilizer (Granular Urea Packs),"State Highway 10 only, avoid central blockades/protest routes",Within 4 hours express timeline,"No sharp tools for loading, keep base dry","Breakage liability clause signed, e-Way Bill attached with documents","High-value target load hai. Material details: Agricultural Fertilizer (Granular Urea Packs). Route map setting: State Highway 10 only, avoid central blockades/protest routes. Strict unloading timing: Within 4 hours express timeline. Setup No sharp tools for loading, keep base dry checks, and checkpost processing ke liye Breakage liability clause signed, e-Way Bill attached with documents verified hona chahiye."
IND-FR-012,Medical Infrastructure (CT Scanner Component Parts),"State Highway 14 network only, avoid water-logged underpass",Within 3 days (Long haul),"Corrosive substance, personal protective equipment for crew mandatory",Pollution Under Control (PUC) & Emergency Response Plan copy present,"Emergency stock replenishment hai driver saab! Maal hai Medical Infrastructure (CT Scanner Component Parts). Location ke liye State Highway 14 network only, avoid water-logged underpass ka use karein aur Within 3 days (Long haul) tak har haal me pahuchein. Corrosive substance, personal protective equipment for crew mandatory ka khyal rakhna, Pollution Under Control (PUC) & Emergency Response Plan copy present sath hona chahiye."
IND-FR-013,E-Commerce Electronics (Smartphones),"Avoid central flyovers, follow hazardous logistics ring",Before 01:00 PM afternoon,"Chilled container (Maintain 14°C to 18°C), zero moisture drop",Medical Supply Emergency Priority Authorization Document Pass verified,"Sir, ye logistics move urgent hai. Cargo: E-Commerce Electronics (Smartphones). Route path: Avoid central flyovers, follow hazardous logistics ring. Deadlines: Before 01:00 PM afternoon. Chilled container (Maintain 14°C to 18°C), zero moisture drop protocol lagao aur factory checkpost pe Medical Supply Emergency Priority Authorization Document Pass verified clear karwana."
IND-FR-014,Industrial Chemical (Nitric Acid Tanker),"Direct highway to city tech park, completely bypass local markets",Within 3 days (Long haul),"Live animal priority tracking, specialized airflow ventilation matrix",Digital OTP delivery system enablement check on driver device,"Dekho bhai, Industrial Chemical (Nitric Acid Tanker) loaded hai gaadi me. Ring road mat lena, Direct highway to city tech park, completely bypass local markets safe rahega. Subah Within 3 days (Long haul) se pehle hub pahuchega toh achha hai. Maal Live animal priority tracking, specialized airflow ventilation matrix hai, and custom pe Digital OTP delivery system enablement check on driver device dikhana padega."
IND-FR-015,Medical Infrastructure (CT Scanner Component Parts),"Shortest market connection lane, bypass checkpoint lines",Within 5 hours absolute transit limit,"Scratch-prone, secure individual padding inside container",Daily Supply Token and Transit Challan verified,"Emergency stock replenishment hai driver saab! Maal hai Medical Infrastructure (CT Scanner Component Parts). Location ke liye Shortest market connection lane, bypass checkpoint lines ka use karein aur Within 5 hours absolute transit limit tak har haal me pahuchein. Scratch-prone, secure individual padding inside container ka khyal rakhna, Daily Supply Token and Transit Challan verified sath hona chahiye."
IND-FR-016,Glass Panels (Architectural Glass),"Direct express route, no unauthorized stops",Before 08:30 AM early slot,"Highly Flammable risk, double fire-retardant tarpaulin used","Breakage liability clause signed, e-Way Bill attached with documents","Attention driver saab: Glass Panels (Architectural Glass) delivery ke liye nikal chuka hai. Strictly Direct express route, no unauthorized stops se jana hai. Unloading target Before 08:30 AM early slot hai. Highly Flammable risk, double fire-retardant tarpaulin used instructions follow karo aur Breakage liability clause signed, e-Way Bill attached with documents ready rakho."
IND-FR-017,Poultry Eggs Cargo,"Monitored container track route, direct arterial expressway link",Before 08:30 AM early slot,"Standard palletized distribution, avoid stacking near wet cargo",Electricity Grid Distribution Authority Order Copy and Form 9 verified,"High-value target load hai. Material details: Poultry Eggs Cargo. Route map setting: Monitored container track route, direct arterial expressway link. Strict unloading timing: Before 08:30 AM early slot. Setup Standard palletized distribution, avoid stacking near wet cargo checks, and checkpost processing ke liye Electricity Grid Distribution Authority Order Copy and Form 9 verified verified hona chahiye."
IND-FR-018,Construction Material (Quartzite Blocks),"Direct arterial corridors, smooth driving pattern tracking maps",By evening 06:30 PM,"Flammable liquid protocols, strictly No Smoking allowed near the vehicle",e-Way Bill must match physical bundle count exactly at border check,"Sir, ye logistics move urgent hai. Cargo: Construction Material (Quartzite Blocks). Route path: Direct arterial corridors, smooth driving pattern tracking maps. Deadlines: By evening 06:30 PM. Flammable liquid protocols, strictly No Smoking allowed near the vehicle protocol lagao aur factory checkpost pe e-Way Bill must match physical bundle count exactly at border check clear karwana."
IND-FR-019,Automotive Parts (Engine Blocks),"Shortest market connection lane, bypass checkpoint lines",By evening 04:30 PM,"Keep 100% dry, double-layer heavy tarpaulin covering mandatory",APMC state mandi transit token sheet approval logs verified,"Suno driver saab, Automotive Parts (Engine Blocks) ka load hamesha critical hota hai. Shortest market connection lane, bypass checkpoint lines corridor hi lena and secure velocity maintain karke By evening 04:30 PM tak report karo. Product is Keep 100% dry, double-layer heavy tarpaulin covering mandatory, aur border par APMC state mandi transit token sheet approval logs verified dikhana hoga."
IND-FR-020,Industrial Gas (Compressed Nitrogen),"Smooth asphalt highway only, skip rough diversion bypass",By morning 09:00 AM,"Enclosed car carrier, hydraulic lift usage, zero scratches protocol","TREM Card (Transport Emergency Card) required, valid PUC on board","High-value target load hai. Material details: Industrial Gas (Compressed Nitrogen). Route map setting: Smooth asphalt highway only, skip rough diversion bypass. Strict unloading timing: By morning 09:00 AM. Setup Enclosed car carrier, hydraulic lift usage, zero scratches protocol checks, and checkpost processing ke liye TREM Card (Transport Emergency Card) required, valid PUC on board verified hona chahiye."
IND-FR-021,Frozen Food (Ice Cream Stock),"No highways during peak hours, outer bypass only",Next day morning delivery priority,"Flammable liquid protocols, strictly No Smoking allowed near the vehicle",Medical Supply Emergency Priority Authorization Document Pass verified,"Sir, ye logistics move urgent hai. Cargo: Frozen Food (Ice Cream Stock). Route path: No highways during peak hours, outer bypass only. Deadlines: Next day morning delivery priority. Flammable liquid protocols, strictly No Smoking allowed near the vehicle protocol lagao aur factory checkpost pe Medical Supply Emergency Priority Authorization Document Pass verified clear karwana."
IND-FR-022,Textile Fabrics (Surat to Delhi Batch),Bypass local market traffic zones completely,Morning 11:00 AM sharp,"Heavy Load, Secure Tie-Downs, anti-rust tarp covering",Digital OTP delivery system enablement check on driver device,"Suno driver saab, Textile Fabrics (Surat to Delhi Batch) ka load hamesha critical hota hai. Bypass local market traffic zones completely corridor hi lena and secure velocity maintain karke Morning 11:00 AM sharp tak report karo. Product is Heavy Load, Secure Tie-Downs, anti-rust tarp covering, aur border par Digital OTP delivery system enablement check on driver device dikhana hoga."
IND-FR-023,Industrial Gas (Compressed Argon Tank),"Bypass city local bottlenecks, stick to industrial ring",Strictly before 07:30 AM,"Keep 100% dry, double-layer heavy tarpaulin covering mandatory",Weight Bridge Slip (Kanta Slip) duplicate verification copy required,"Bhai, Industrial Gas (Compressed Argon Tank) ka critical consignment hai. Route me Bypass city local bottlenecks, stick to industrial ring follow karna aur Strictly before 07:30 AM tak deliver kar dena. Keep 100% dry, double-layer heavy tarpaulin covering mandatory maintain rakhna, checkpost pe Weight Bridge Slip (Kanta Slip) duplicate verification copy required check hoga."
IND-FR-024,E-Commerce (Laptops & Tablets),"No low-clearance bridges, follow approved ODC route map",By evening 04:30 PM,"Fragile, Glassware protocol, side foam padding required",Electricity Grid Distribution Authority Order Copy and Form 9 verified,"Important transport update! Consignment category: E-Commerce (Laptops & Tablets). No low-clearance bridges, follow approved ODC route map track follow karna delay se bachne ke liye. Delivery window is By evening 04:30 PM. Take care of Fragile, Glassware protocol, side foam padding required. Keep Electricity Grid Distribution Authority Order Copy and Form 9 verified handy on dashboard."
IND-FR-025,Frozen Food (Ready-to-Eat Meals),"High-security logistics route, avoid dark zones/isolated halts",Strictly before 10:00 AM,"Chemical handling, protective masks for loaders mandatory",Transit Cover Insurance Copy & Custom Invoice record active,"Bhai, Frozen Food (Ready-to-Eat Meals) ka critical consignment hai. Route me High-security logistics route, avoid dark zones/isolated halts follow karna aur Strictly before 10:00 AM tak deliver kar dena. Chemical handling, protective masks for loaders mandatory maintain rakhna, checkpost pe Transit Cover Insurance Copy & Custom Invoice record active check hoga."
IND-FR-026,FMCG (Edible Oil Pouches),"NH-62 ODC corridor, strictly avoid sharp hairpin bends",Within 48 hours long-haul transit parameters,"High Value, Tamper-evident digital seals, fragile handling",NHAI heavy cargo dimension clearance permit active in fleet system,"Attention driver saab: FMCG (Edible Oil Pouches) delivery ke liye nikal chuka hai. Strictly NH-62 ODC corridor, strictly avoid sharp hairpin bends se jana hai. Unloading target Within 48 hours long-haul transit parameters hai. High Value, Tamper-evident digital seals, fragile handling instructions follow karo aur NHAI heavy cargo dimension clearance permit active in fleet system ready rakho."
IND-FR-027,Agricultural Fertilizer (Liquid Organic NPK Canisters),"State Highway 11 pathway corridor, avoid central local blockades",Before midnight tonight,"Heavy weight balanced vertical blocks, lock steel clamp array",OTP verification authorization validation activated on terminal map,"Emergency stock replenishment hai driver saab! Maal hai Agricultural Fertilizer (Liquid Organic NPK Canisters). Location ke liye State Highway 11 pathway corridor, avoid central local blockades ka use karein aur Before midnight tonight tak har haal me pahuchein. Heavy weight balanced vertical blocks, lock steel clamp array ka khyal rakhna, OTP verification authorization validation activated on terminal map sath hona chahiye."
IND-FR-028,Frozen Food (Frozen Fish Fillets),"State Highway 14 network only, avoid water-logged underpass",Within 3 days (Long haul),"Highly Fragile medical diagnostic components, strict vibration sensor logs",Retail Invoice and Signed Inward Delivery Acknowledgement verified,"Bhai, Frozen Food (Frozen Fish Fillets) ka critical consignment hai. Route me State Highway 14 network only, avoid water-logged underpass follow karna aur Within 3 days (Long haul) tak deliver kar dena. Highly Fragile medical diagnostic components, strict vibration sensor logs maintain rakhna, checkpost pe Retail Invoice and Signed Inward Delivery Acknowledgement verified check hoga."
IND-FR-029,Industrial Gas (Compressed Argon Tank),"Avoid newly laid asphalt patches, follow stable industrial bypass",Within 2 hours express emergency routing schedule,"Deep Freeze (-18°C), Fragile packaging",Loading challan and toll receipts for reimbursement verification,"Important transport update! Consignment category: Industrial Gas (Compressed Argon Tank). Avoid newly laid asphalt patches, follow stable industrial bypass track follow karna delay se bachne ke liye. Delivery window is Within 2 hours express emergency routing schedule. Take care of Deep Freeze (-18°C), Fragile packaging. Keep Loading challan and toll receipts for reimbursement verification handy on dashboard."
IND-FR-030,Poultry Feed Bags,"Shortest state highway links, skip city commercial bottlenecks",Strictly before 11:00 AM launch event,"Temperature sensitive, clean crates requirement","Octroi Exempt Form (Govt hospital delivery), Delivery Challan signed","Attention driver saab: Poultry Feed Bags delivery ke liye nikal chuka hai. Strictly Shortest state highway links, skip city commercial bottlenecks se jana hai. Unloading target Strictly before 11:00 AM launch event hai. Temperature sensitive, clean crates requirement instructions follow karo aur Octroi Exempt Form (Govt hospital delivery), Delivery Challan signed ready rakho."
IND-FR-031,Frozen Food (Ice Cream Stock),"Avoid narrow city inner circles, follow heavy clearance map",Before 01:00 PM afternoon,"Highly Fragile medical diagnostic components, strict vibration sensor logs","TREM Card (Transport Emergency Card) required, valid PUC on board","Sir, ye logistics move urgent hai. Cargo: Frozen Food (Ice Cream Stock). Route path: Avoid narrow city inner circles, follow heavy clearance map. Deadlines: Before 01:00 PM afternoon. Highly Fragile medical diagnostic components, strict vibration sensor logs protocol lagao aur factory checkpost pe TREM Card (Transport Emergency Card) required, valid PUC on board clear karwana."
IND-FR-032,E-Commerce Electronics (Smartphones),"Direct highway line, bypass chaotic weekend markets",Within 24 hours transit window,"Chemical handling, protective masks for loaders mandatory",e-Way Bill must match physical bundle count exactly at border check,"Suno driver saab, E-Commerce Electronics (Smartphones) ka load hamesha critical hota hai. Direct highway line, bypass chaotic weekend markets corridor hi lena and secure velocity maintain karke Within 24 hours transit window tak report karo. Product is Chemical handling, protective masks for loaders mandatory, aur border par e-Way Bill must match physical bundle count exactly at border check dikhana hoga."
IND-FR-033,Poultry Eggs Cargo,Avoid waterlogging-prone low underpasses completely,Afternoon slot (02:00 PM - 05:00 PM),"Shock-sensitive cargo, high-security padlock, fragile",Breakage Policy Document & Delivery Challan signed by dispatcher,"Important transport update! Consignment category: Poultry Eggs Cargo. Avoid waterlogging-prone low underpasses completely track follow karna delay se bachne ke liye. Delivery window is Afternoon slot (02:00 PM - 05:00 PM). Take care of Shock-sensitive cargo, high-security padlock, fragile. Keep Breakage Policy Document & Delivery Challan signed by dispatcher handy on dashboard."
IND-FR-034,Heavy Electricals (Industrial Gen-Sets),"High-security strategic expressway, avoid unmonitored road segments",Morning slot (09:00 AM - 11:30 AM),"Heavy stack, weatherproof multi-layer covering mandatory","Octroi Exempt Form (Govt hospital delivery), Delivery Challan signed","Emergency stock replenishment hai driver saab! Maal hai Heavy Electricals (Industrial Gen-Sets). Location ke liye High-security strategic expressway, avoid unmonitored road segments ka use karein aur Morning slot (09:00 AM - 11:30 AM) tak har haal me pahuchein. Heavy stack, weatherproof multi-layer covering mandatory ka khyal rakhna, Octroi Exempt Form (Govt hospital delivery), Delivery Challan signed sath hona chahiye."
IND-FR-035,Pharmaceuticals (Antibiotic Liquids),Stick to designated dangerous goods transit pathways,By evening (Before 06:00 PM),"Moisture-sensitive, individual vacuum packing protection",Weight Bridge Slip (Kanta Slip) duplicate verification copy required,"Emergency stock replenishment hai driver saab! Maal hai Pharmaceuticals (Antibiotic Liquids). Location ke liye Stick to designated dangerous goods transit pathways ka use karein aur By evening (Before 06:00 PM) tak har haal me pahuchein. Moisture-sensitive, individual vacuum packing protection ka khyal rakhna, Weight Bridge Slip (Kanta Slip) duplicate verification copy required sath hona chahiye."
IND-FR-036,Industrial Gas (Compressed Nitrogen),"State Highway 10 only, avoid central blockades/protest routes",Strictly before 09:00 AM,"Heavy Load, Secure Tie-Downs, anti-rust tarp covering",Medical Supply Emergency Priority Authorization Document Pass verified,"Bhai, Industrial Gas (Compressed Nitrogen) ka critical consignment hai. Route me State Highway 10 only, avoid central blockades/protest routes follow karna aur Strictly before 09:00 AM tak deliver kar dena. Heavy Load, Secure Tie-Downs, anti-rust tarp covering maintain rakhna, checkpost pe Medical Supply Emergency Priority Authorization Document Pass verified check hoga."
IND-FR-037,Live Poultry (Day-Old Hatchlings),Avoid waterlogging-prone routes and low-security zones,Within 2 hours max (Urgent replenishment),"Deep Freeze (-20°C), continuous temperature data logging",Gate Pass & Triplicate Invoice copy needed at factory gate,"Emergency stock replenishment hai driver saab! Maal hai Live Poultry (Day-Old Hatchlings). Location ke liye Avoid waterlogging-prone routes and low-security zones ka use karein aur Within 2 hours max (Urgent replenishment) tak har haal me pahuchein. Deep Freeze (-20°C), continuous temperature data logging ka khyal rakhna, Gate Pass & Triplicate Invoice copy needed at factory gate sath hona chahiye."
IND-FR-038,Automotive Parts (Wiring Harnesses),"Strictly follow high load ODC clearance maps, avoid low utility wires",Within 2 hours express emergency routing schedule,"Standard palletized distribution, avoid stacking near wet cargo",Active digital e-Way Bill tracking map enabled on dispatcher console,"Sir, ye logistics move urgent hai. Cargo: Automotive Parts (Wiring Harnesses). Route path: Strictly follow high load ODC clearance maps, avoid low utility wires. Deadlines: Within 2 hours express emergency routing schedule. Standard palletized distribution, avoid stacking near wet cargo protocol lagao aur factory checkpost pe Active digital e-Way Bill tracking map enabled on dispatcher console clear karwana."
